<?xml version="1.0"?>
<!DOCTYPE sdmetrics SYSTEM 'metrics.dtd'>

<!-- metrics.xml

SDMetrics V2.2 metric definitions for the UML1.x default metamodel
Copyright (c) 2002-2011 Juergen Wuest

The MIT License

Permission is hereby granted, free of charge, to any person obtaining a copy
of this SDMetrics project file (the "Project File"), to deal in the Project File 
without restriction, including without limitation the rights
to use, copy, modify, merge, publish, distribute, sublicense, and/or sell
copies of the Project File, and to permit persons to whom the Project File is
furnished to do so, subject to the following conditions:

The above copyright notice and this permission notice shall be included in
all copies or substantial portions of the Project File.

THE PROJECT FILE IS PROVIDED "AS IS", WITHOUT WARRANTY OF ANY KIND, EXPRESS OR
IMPLIED, INCLUDING BUT NOT LIMITED TO THE WARRANTIES OF MERCHANTABILITY,
FITNESS FOR A PARTICULAR PURPOSE AND NONINFRINGEMENT. IN NO EVENT SHALL THE
AUTHORS OR COPYRIGHT HOLDERS BE LIABLE FOR ANY CLAIM, DAMAGES OR OTHER
LIABILITY, WHETHER IN AN ACTION OF CONTRACT, TORT OR OTHERWISE, ARISING FROM,
OUT OF OR IN CONNECTION WITH THE SOFTWARE OR THE USE OR OTHER DEALINGS IN
THE PROJECT FILE.

Note: this license grant only applies to this Project File, and not to any
other part of SDMetrics.

-->

<sdmetrics version="2.0" ruleexemption="taggedvalue" exemptiontag="tagname">


<!-- class metrics -->
<!-- class size -->

<metric name="NumAttr" domain="class" category="Size">
<description>The number of attributes in the class.((p))
This metric counts all attributes regardless of their type (data type,
class or interface), visibility, changeability (read only
or not), and owner scope (class-scope, i.e. static, or instance
attribute). Inherited attributes are not counted.
((ul))((li))Also known as: NV (Number of Variables per class)
ref://LK94/.((/ul))
</description>
<projection relation="context" target="attribute" />
</metric>

<metric name="NumOps" domain="class" category="Size">
<description>The number of operations in a class.((p))
Includes all operations in the class that are explicitly modeled
(overriding operations, constructors, destructors), regardless
of their visibility, owner scope (class-scope, i.e., static),
or whether they are abstract or not. Inherited operations are
not counted.
((ul))
((li))Also known as: WMC (Weighted method complexity) where each operation is
assigned unity complexity ref://CK94/.
((li))Also known as: NM (Number of Methods) ref://LK94/.
((/ul))
</description>
<projection relation="context" target="operation" />
</metric>

<metric name="NumPubOps" domain="class" category="Size">
<description>The number of public operations in a class.((p))
Same as metric metric://class/NumOps/, but only counts operations with
public visibility. Measures the size of the class in terms
of its public interface.
((ul))((li))Also known as: NPM (Number of Public Methods)
ref://LK94/.((/ul))
</description>
<projection relation="context" target="operation" condition="visibility='public'"/>
</metric>

<metric name="Setters" domain="class" category="Size">
<description>The number of operations with a name starting with 'set'.((p))
Note that this metric does not always yield accurate results. For example, an
operation ((code))settleAccount((/code)) will be counted as setter method.
((ul))((li))See also: metric://class/Getters/.((/ul))
</description>
<projection relation="context" target="operation" condition="name startswith 'set'" />
</metric>

<metric name="Getters" domain="class" category="Size">
<description>The number of operations with a name starting with 'get', 'is', or
'has'.((p))
Note that this metric does not always yield accurate results. For example, an
operation ((code))isolateNode((/code)) will be counted as getter method.
((ul))((li))See also: metric://class/Setters/.((/ul))
</description>
<projection relation="context" target="operation" sum="GetterName" />
</metric>

<!-- class nesting structure -->
<metric name="Nesting" domain="class">
<description>The nesting level of the class (for inner classes).((p))
Measures how deeply a class is nested within other classes.
Classes not defined in the context of another class have nesting level 0,
their inner classes have nesting level 1, etc.
Nesting levels deeper than 1 are unusual; an excessive nesting structure
is difficult to understand, and should be revised.</description>
<nesting relation="context" />
</metric>


<!-- class inheritance -->

<set name="ImplInterfaces" domain="class">
<description>The set of interfaces the class implements.</description>
<projection relation="absclient" target="abstraction" element="abssupplier" />
</set>

<metric name="IFImpl" domain="class" category="Inheritance">
<description>The number of interfaces the class implements (UML Abstraction).((p))
This only counts direct relationships from the class to the interface. For
example, if a class ((i))C((/i)) implements an interface ((i))I((/i)),
which extends some other interfaces, only interface ((i))I((/i))
will be counted, but not the interfaces that ((i))I((/i)) extends
(even though class ((i))c((/i)) implements those interfaces, too).</description>
<compoundmetric term="size(ImplInterfaces)" />
</metric>

<metric name="NOC" domain="class" category="Inheritance">
<description>The number of children of the class (UML Generalization).((p))
Similar to glossary://Coupling (export)/export coupling/, NOC indicates the
potential influence a class has on the design.
If a class has a large number of children, it may require more testing of the
methods in that class. A large number of child classes may indicate improper
abstraction of the parent class.
((ul))((li))Defined in ref://CK94/.((/ul))
</description>
<projection relation="genparent" target="generalization" element="genchild" />
</metric>

<metric name="NumDesc" domain="class" category="Inheritance">
<description>The number of descendents of the class (UML Generalization).((p))
Counts the number of children of the class, their children, and so on.
((ul))
((li))See also: metric://class/NOC/ (Number of Children).
((li))Suggested in ref://LC94/ and ref://TSM92/.
((/ul))
</description>
<compoundmetric term="size(DescSet)" />
</metric>

<metric name="NumAnc" domain="class" category="Inheritance">
<description>The number of ancestors of the class.((p))
Counts the number of parents of the class, their parents, and so on.
If multiple inheritance is not used, the metric yields the same
values as metric://class/DIT/.
((ul))((li))Suggested in ref://LC94/ and ref://TSM92/.((/ul))
</description>
<compoundmetric term="size(AncSet)" />
</metric>

<metric name="DIT" domain="class" category="Inheritance">
<description>The depth of the class in the inheritance hierarchy.((p))
This is calculated as the longest path from the class to the root of
the inheritance tree. The DIT for a class that has no parents is 0.((p))
Classes with high DIT inherit from many classes and thus are more
difficult to understand. Also, classes with high DIT may not be proper
specializations of all of their ancestor classes.
((ul))((li))Defined in ref://CK94/.((/ul))
</description>
<projection relation="genchild" target="generalization" element="genparent" eltype="class" nesting="true"/>
</metric>

<metric name="CLD" domain="class" category="Inheritance">
<description>Class to leaf depth. The longest path from the class to a leaf
node in the inheritance hierarchy below the class.
((ul))((li))Defined in ref://TSM92/.
((li))See also: metric://class/NOC/ (Number of Children).((/ul))
</description>
<projection relation="genparent" target="generalization" element="genchild" eltype="class" nesting="true"/>
</metric>

<set name="Parents" domain="class">
<description>The set of parents of the class.</description>
<projection relation="genchild" target="generalization" element="genparent" eltype="class"/>
</set>

<set name="Children" domain="class">
<description>The set of child classes of the class.</description>
<projection relation="genparent" target="generalization" element="genchild" eltype="class"/>
</set>

<set name="AncSet" domain="class">
<description>The set of ancestors of the class.</description>
<projection relation="genchild" target="generalization" element="genparent" eltype="class" recurse="true" />
</set>

<set name="DescSet" domain="class">
<description>The set of descendents of the class.</description>
<projection relation="genparent" target="generalization" element="genchild" eltype="class" recurse="true" />
</set>

<metric name="OpsInh" domain="class" category="Inheritance">
<description>The number of inherited operations.((p))
This is calculated as the sum of metric metric://class/NumOps/ taken over
all ancestor classes of the class.
((ul))((li))Also known as NMI ref://LK94/.
((li))See also: metric://class/DIT/.((/ul))
</description>
<projection relation="genchild" target="generalization" element="genparent" eltype="class" sum="NumOps" recurse="true"/>
</metric>

<metric name="AttrInh" domain="class" category="Inheritance">
<description>The number of inherited attributes.((p))
This is calculated as the sum of metric metric://class/NumAttr/ taken over
all ancestor classes of the class.
((ul))((li))Loosely based on AIF in ref://AGE95/.((/ul))
</description>
<projection relation="genchild" target="generalization" element="genparent" eltype="class" sum="NumAttr" recurse="true"/>
</metric>


<!-- class coupling -->

<metric name="Dep_Out" domain="class" category="Coupling (import)">
<description>The number of dependencies where the class is the client.((p))
This metric counts outgoing plain UML dependencies and usage dependencies
(shown as dashed arrows in class diagrams, usage with 'use' stereotype).